{
  "$schema": "https://json-schema.org/draft/2020-12/schema",
  "$id": "brain.schema.json",
  "title": "brain.json",
  "description": "BRAINLLM app configuration. Precedence: flag > BRAIN_* variable > brain.json > defaults.",
  "type": "object",
  "properties": {
    "$schema": {
      "type": "string"
    },
    "name": {
      "type": "string",
      "description": "App name (SEO, web manifest)."
    },
    "description": {
      "type": "string"
    },
    "lang": {
      "type": "string",
      "description": "Default document language, e.g. \"en\"."
    },
    "site": {
      "type": "string",
      "format": "uri",
      "description": "Public origin, e.g. https://example.com. Prefer PUBLIC_SITE_URL in .brain_env."
    },
    "base": {
      "type": "string",
      "pattern": "^/([^/?#\\s]+/)*$",
      "default": "/",
      "description": "Path the app is hosted under: starts and ends with \"/\", e.g. \"/app/\". brain run, brain build and brain start serve every URL under it."
    },
    "backend": {
      "type": "object",
      "additionalProperties": false,
      "description": "Explicit native backend HTTP origins and opt-in live resource rooms; no credential values.",
      "properties": {
        "origins": {
          "type": "array",
          "minItems": 1,
          "maxItems": 8,
          "uniqueItems": true,
          "items": { "type": "string", "format": "uri", "pattern": "^https?://[^/@?#\\s]+$" },
          "description": "Canonical public HTTP(S) origins without path or trailing slash. Defaults to the origin of PUBLIC_SITE_URL. --origin replaces this list."
        },
        "sockets": {
          "description": "Absent/false disables native live resources. Every socket origin must also occur in the resolved HTTP origins; no implicit CORS expansion.",
          "oneOf": [
            { "const": false },
            {
              "type": "object",
              "additionalProperties": false,
              "required": ["allowedOrigins"],
              "properties": {
                "allowedOrigins": {
                  "type": "array",
                  "minItems": 1,
                  "maxItems": 8,
                  "uniqueItems": true,
                  "items": { "type": "string", "format": "uri", "pattern": "^https?://[^/@?#\\s]+$" }
                }
              }
            }
          ]
        }
      }
    },
    "cache": {
      "type": "object",
      "properties": {
        "http": {
          "type": "boolean",
          "default": true
        },
        "sw": {
          "type": "boolean",
          "default": true
        },
        "offline": {
          "type": "boolean",
          "default": true
        },
        "data": {
          "type": "boolean",
          "default": true
        },
        "precacheKB": {
          "type": "number",
          "minimum": 0,
          "default": 2048
        }
      }
    },
    "seo": {
      "type": "object",
      "properties": {
        "minScore": {
          "type": "number",
          "minimum": 0,
          "maximum": 100,
          "default": 80
        },
        "sitemap": {
          "type": "boolean",
          "default": true
        },
        "llms": {
          "type": "boolean",
          "default": true
        },
        "llmsFull": {
          "type": "boolean",
          "default": true
        },
        "manifest": {
          "type": "boolean",
          "default": true
        },
        "indexnow": {
          "type": "boolean",
          "default": false
        },
        "markdown": {
          "type": "boolean",
          "default": true,
          "description": "Publish a Markdown copy of every indexable page (/pricing.md), link it, and serve it on the page URL when Accept prefers text/markdown (Vary: Accept); false turns all three off"
        },
        "feed": {
          "type": "boolean",
          "default": true,
          "description": "Write rss.xml (site feed, like WordPress /feed) and <section>/rss.xml for each section without a content collection, linked from every page; false turns them off"
        },
        "sections": {
          "type": "boolean",
          "default": true,
          "description": "Write sections.json, the manifest of every section (title, description, home page, feed and pages with URL, Markdown copy and lastmod), linked from every page; false turns it off"
        },
        "ai": {
          "enum": [
            "allow",
            "search-only",
            "block"
          ],
          "default": "allow",
          "description": "AI crawler policy in robots.txt: allow (training, answers, search), search-only (no training) or block (no AI crawler)"
        },
        "og": {
          "enum": [
            "missing",
            "always",
            "off"
          ],
          "default": "missing",
          "description": "Generated Open Graph images: only for pages without og:image, for every page, or never"
        },
        "search": {
          "type": "string",
          "pattern": "\\{query\\}",
          "description": "Site search URL with {query}, added as a SearchAction to the home page WebSite JSON-LD"
        },
        "news": {
          "type": "object",
          "required": [
            "name",
            "collections"
          ],
          "properties": {
            "name": {
              "type": "string",
              "description": "Publication name Google News shows"
            },
            "collections": {
              "type": "array",
              "minItems": 1,
              "items": {
                "type": "string"
              }
            }
          },
          "description": "Google News sitemap from these content collections"
        }
      }
    },
    "analytics": {
      "description": "First-party behavior analytics stored in the native backend's Postgres (docs/backend/analytics.md). On by default when a native backend runs; false turns it off.",
      "oneOf": [
        { "type": "boolean" },
        {
          "type": "object",
          "additionalProperties": false,
          "properties": {
            "enabled": { "type": "boolean" },
            "consent": { "enum": ["required", "none"], "description": "required: record nothing until consent('analytics')" },
            "retentionDays": { "type": "integer", "minimum": 1, "maximum": 3650, "default": 180 },
            "countryHeader": { "type": "string", "pattern": "^[a-z0-9-]{1,64}$", "description": "Proxy header with an ISO country code, e.g. cf-ipcountry" },
            "eventsPerMinute": { "type": "integer", "minimum": 1, "maximum": 6000, "default": 600 }
          }
        }
      ]
    },
    "budget": {
      "type": "object",
      "additionalProperties": false,
      "description": "Build byte budgets. mountMs and heapMB are planned browser measurements and are rejected until implemented.",
      "properties": {
        "viewKB": {
          "type": "number",
          "minimum": 0,
          "description": "Maximum KiB (1024 bytes) of emitted JS, CSS and HTML per route. Uses gzip when smaller, otherwise raw bytes; includes the conservatively reachable JS graph, including lazy chunks. Excludes images/fonts. Exceeding this value fails build."
        }
      }
    },
    "i18n": {
      "type": "object",
      "properties": {
        "default": {
          "type": "string"
        },
        "locales": {
          "type": "array",
          "items": {
            "type": "string"
          }
        }
      }
    },
    "ext": {
      "type": "string",
      "enum": [
        "web",
        "brain"
      ],
      "default": "web",
      "description": "Published file names: web (.html/.js/.css) or brain (.brain/.jsbrain/.cssbrain, with Content-Type set by _headers, nginx and Caddy). brain build --ext overrides it."
    },
    "lint": {
      "type": "object",
      "description": "Per-rule level, e.g. {\"B1307\": \"off\"}. Only the quality families (B09xx-B13xx) can be changed; other overrides are ignored.",
      "propertyNames": {
        "pattern": "^B(09|1[0-3])[0-9]{2}$"
      },
      "additionalProperties": {
        "enum": [
          "off",
          "info",
          "warning",
          "error"
        ]
      }
    },
    "targets": {
      "oneOf": [
        {
          "enum": [
            "baseline-widely",
            "baseline-newly"
          ]
        },
        {
          "type": "string",
          "pattern": "^baseline-(201[5-9]|20[2-9][0-9])$"
        }
      ],
      "default": "baseline-widely",
      "description": "Browser support target for B21xx warnings. Explicit years must not be newer than the pinned web-features dataset."
    }
  }
}
